Title,Author,Number of Chapters
Overview of Castle Swimmer Webtoon,Wendy Lian Martin,1
Castle Swimmer Review: Character Development,Wendy Lian Martin,1
Kappa And Siren,Wendy Lian Martin,1
Castle Swimmer Review: Supporting Characters,Wendy Lian Martin,1
Art and Visual Aesthetics,Wendy Lian Martin,1
Castle Swimmer Review: Themes and Messages,Wendy Lian Martin,1
Prophecy Vs. Choice,Wendy Lian Martin,1
Love and Acceptance,Wendy Lian Martin,1
Conclusion: Read the Castle Swimmer Webtoon,Wendy Lian Martin,1
